{
  "scene_id": "salinas-a-corrected",
  "method_id": "patch_15",
  "role": "document_constructor",
  "n_groups": 36,
  "group_size_distribution": {
    "min": 88,
    "p5": 120.0,
    "p25": 165.0,
    "median": 225.0,
    "p75": 225.0,
    "p95": 225.0,
    "max": 225,
    "mean": 198.277778
  },
  "between_within_ratio": 2.204453,
  "group_ids": [
    1,
    2,
    3,
    4,
    5,
    6,
    7,
    8,
    9,
    10,
    11,
    12,
    13,
    14,
    15,
    16,
    17,
    18,
    19,
    20,
    21,
    22,
    23,
    24,
    25,
    26,
    27,
    28,
    29,
    30,
    31,
    32,
    33,
    34,
    35,
    36
  ],
  "mean_spectrum_per_group": {
    "format": "binary_f32",
    "shape": [
      36,
      204
    ],
    "path": "data/derived/groupings/patch_15/salinas-a-corrected.mean.bin"
  },
  "std_spectrum_per_group": {
    "format": "binary_f32",
    "shape": [
      36,
      204
    ],
    "path": "data/derived/groupings/patch_15/salinas-a-corrected.std.bin"
  },
  "agreement_with_label": {
    "ari": 0.168108,
    "nmi": 0.530727,
    "v_measure": 0.530727
  },
  "agreement_with_methods": {
    "slic_200": {
      "ari": 0.223873,
      "nmi": 0.736954,
      "v_measure": 0.736954
    }
  },
  "centroid_embedding_2d": [
    {
      "group_id": 1,
      "coords": [
        -40.214905,
        7.605885
      ]
    },
    {
      "group_id": 2,
      "coords": [
        -30.701023,
        4.282524
      ]
    },
    {
      "group_id": 3,
      "coords": [
        6.935608,
        3.738014
      ]
    },
    {
      "group_id": 4,
      "coords": [
        13.887961,
        5.870927
      ]
    },
    {
      "group_id": 5,
      "coords": [
        11.193469,
        -5.888906
      ]
    },
    {
      "group_id": 6,
      "coords": [
        8.969756,
        -7.687024
      ]
    },
    {
      "group_id": 7,
      "coords": [
        -8.516571,
        0.850195
      ]
    },
    {
      "group_id": 8,
      "coords": [
        13.133992,
        4.114353
      ]
    },
    {
      "group_id": 9,
      "coords": [
        12.832664,
        0.123599
      ]
    },
    {
      "group_id": 10,
      "coords": [
        10.047968,
        -5.606501
      ]
    },
    {
      "group_id": 11,
      "coords": [
        5.094529,
        -4.592693
      ]
    },
    {
      "group_id": 12,
      "coords": [
        -1.554536,
        -4.071252
      ]
    },
    {
      "group_id": 13,
      "coords": [
        12.367422,
        -0.23753
      ]
    },
    {
      "group_id": 14,
      "coords": [
        10.661993,
        -5.333836
      ]
    },
    {
      "group_id": 15,
      "coords": [
        6.677829,
        -4.486276
      ]
    },
    {
      "group_id": 16,
      "coords": [
        -1.428548,
        -4.074946
      ]
    },
    {
      "group_id": 17,
      "coords": [
        -9.760883,
        -0.958149
      ]
    },
    {
      "group_id": 18,
      "coords": [
        -13.036878,
        -0.366485
      ]
    },
    {
      "group_id": 19,
      "coords": [
        8.375151,
        -3.930105
      ]
    },
    {
      "group_id": 20,
      "coords": [
        1.472905,
        -3.074868
      ]
    },
    {
      "group_id": 21,
      "coords": [
        -8.046001,
        -0.827637
      ]
    },
    {
      "group_id": 22,
      "coords": [
        -14.81753,
        -0.222898
      ]
    },
    {
      "group_id": 23,
      "coords": [
        -9.652582,
        -3.408093
      ]
    },
    {
      "group_id": 24,
      "coords": [
        0.166644,
        0.991906
      ]
    },
    {
      "group_id": 25,
      "coords": [
        -5.541073,
        -1.270987
      ]
    },
    {
      "group_id": 26,
      "coords": [
        -13.806129,
        0.493654
      ]
    },
    {
      "group_id": 27,
      "coords": [
        -12.734754,
        -3.039475
      ]
    },
    {
      "group_id": 28,
      "coords": [
        0.509177,
        -1.469182
      ]
    },
    {
      "group_id": 29,
      "coords": [
        9.982444,
        5.539816
      ]
    },
    {
      "group_id": 30,
      "coords": [
        14.162712,
        8.83365
      ]
    },
    {
      "group_id": 31,
      "coords": [
        -16.785059,
        0.680898
      ]
    },
    {
      "group_id": 32,
      "coords": [
        -8.363297,
        -5.340962
      ]
    },
    {
      "group_id": 33,
      "coords": [
        5.253396,
        3.277117
      ]
    },
    {
      "group_id": 34,
      "coords": [
        11.450415,
        4.969822
      ]
    },
    {
      "group_id": 35,
      "coords": [
        15.46252,
        10.315632
      ]
    },
    {
      "group_id": 36,
      "coords": [
        16.321213,
        4.199814
      ]
    }
  ],
  "centroid_embedding_3d": [
    {
      "group_id": 1,
      "coords": [
        -40.214905,
        7.605885,
        5.593912
      ]
    },
    {
      "group_id": 2,
      "coords": [
        -30.701023,
        4.282524,
        4.524709
      ]
    },
    {
      "group_id": 3,
      "coords": [
        6.935608,
        3.738014,
        1.444703
      ]
    },
    {
      "group_id": 4,
      "coords": [
        13.887961,
        5.870927,
        0.963624
      ]
    },
    {
      "group_id": 5,
      "coords": [
        11.193469,
        -5.888906,
        3.340245
      ]
    },
    {
      "group_id": 6,
      "coords": [
        8.969756,
        -7.687024,
        2.889344
      ]
    },
    {
      "group_id": 7,
      "coords": [
        -8.516571,
        0.850195,
        3.417566
      ]
    },
    {
      "group_id": 8,
      "coords": [
        13.133992,
        4.114353,
        1.125513
      ]
    },
    {
      "group_id": 9,
      "coords": [
        12.832664,
        0.123599,
        2.224378
      ]
    },
    {
      "group_id": 10,
      "coords": [
        10.047968,
        -5.606501,
        2.08442
      ]
    },
    {
      "group_id": 11,
      "coords": [
        5.094529,
        -4.592693,
        0.89369
      ]
    },
    {
      "group_id": 12,
      "coords": [
        -1.554536,
        -4.071252,
        0.232814
      ]
    },
    {
      "group_id": 13,
      "coords": [
        12.367422,
        -0.23753,
        2.264886
      ]
    },
    {
      "group_id": 14,
      "coords": [
        10.661993,
        -5.333836,
        2.406512
      ]
    },
    {
      "group_id": 15,
      "coords": [
        6.677829,
        -4.486276,
        0.856617
      ]
    },
    {
      "group_id": 16,
      "coords": [
        -1.428548,
        -4.074946,
        -0.321028
      ]
    },
    {
      "group_id": 17,
      "coords": [
        -9.760883,
        -0.958149,
        -1.079387
      ]
    },
    {
      "group_id": 18,
      "coords": [
        -13.036878,
        -0.366485,
        -2.238744
      ]
    },
    {
      "group_id": 19,
      "coords": [
        8.375151,
        -3.930105,
        2.13502
      ]
    },
    {
      "group_id": 20,
      "coords": [
        1.472905,
        -3.074868,
        0.820556
      ]
    },
    {
      "group_id": 21,
      "coords": [
        -8.046001,
        -0.827637,
        -0.309781
      ]
    },
    {
      "group_id": 22,
      "coords": [
        -14.81753,
        -0.222898,
        -1.933055
      ]
    },
    {
      "group_id": 23,
      "coords": [
        -9.652582,
        -3.408093,
        -3.979975
      ]
    },
    {
      "group_id": 24,
      "coords": [
        0.166644,
        0.991906,
        -4.34663
      ]
    },
    {
      "group_id": 25,
      "coords": [
        -5.541073,
        -1.270987,
        0.288267
      ]
    },
    {
      "group_id": 26,
      "coords": [
        -13.806129,
        0.493654,
        -0.783277
      ]
    },
    {
      "group_id": 27,
      "coords": [
        -12.734754,
        -3.039475,
        -3.256441
      ]
    },
    {
      "group_id": 28,
      "coords": [
        0.509177,
        -1.469182,
        -4.260919
      ]
    },
    {
      "group_id": 29,
      "coords": [
        9.982444,
        5.539816,
        -2.972544
      ]
    },
    {
      "group_id": 30,
      "coords": [
        14.162712,
        8.83365,
        -1.283638
      ]
    },
    {
      "group_id": 31,
      "coords": [
        -16.785059,
        0.680898,
        -1.294912
      ]
    },
    {
      "group_id": 32,
      "coords": [
        -8.363297,
        -5.340962,
        -4.943992
      ]
    },
    {
      "group_id": 33,
      "coords": [
        5.253396,
        3.277117,
        -4.61511
      ]
    },
    {
      "group_id": 34,
      "coords": [
        11.450415,
        4.969822,
        -1.719531
      ]
    },
    {
      "group_id": 35,
      "coords": [
        15.46252,
        10.315632,
        -0.70185
      ]
    },
    {
      "group_id": 36,
      "coords": [
        16.321213,
        4.199814,
        2.534036
      ]
    }
  ],
  "preview_path": "/generated/groupings/previews/salinas-a-corrected-patch_15.png"
}
